[
  {
    "source_file": "ax2009-finance-inventory.csv",
    "category": "object",
    "object_type": "Class",
    "name": "LedgerJournalPostOverride",
    "layer": "CUS",
    "module": "Finance",
    "usage": "High",
    "complexity": "High",
    "technology": "X++",
    "business_purpose": "Custom ledger journal posting",
    "risk_flags": [
      "overlayering",
      "posting"
    ],
    "disposition": "Extend",
    "target_pattern": "Chain of Command or event handler",
    "effort_points": 9,
    "confidence": "High",
    "confidence_reason": "Inventory row contains strong classification evidence.",
    "rationale": "Customization likely needs extension-based migration."
  },
  {
    "source_file": "ax2009-finance-inventory.csv",
    "category": "object",
    "object_type": "Form",
    "name": "DimensionLegacyEditor",
    "layer": "USR",
    "module": "Finance",
    "usage": "Low",
    "complexity": "Medium",
    "technology": "X++",
    "business_purpose": "Old dimension maintenance form",
    "risk_flags": [
      "overlayering"
    ],
    "disposition": "Retire Candidate",
    "target_pattern": "Business validation before migration",
    "effort_points": 7,
    "confidence": "High",
    "confidence_reason": "Inventory row contains strong classification evidence.",
    "rationale": "Low usage suggests scope reduction opportunity."
  },
  {
    "source_file": "ax2009-finance-inventory.csv",
    "category": "integration",
    "object_type": "Interface",
    "name": "GLTrialBalanceSqlExport",
    "layer": "CUS",
    "module": "Finance",
    "usage": "Daily",
    "complexity": "High",
    "technology": "Direct SQL",
    "business_purpose": "Exports trial balance to data warehouse",
    "risk_flags": [
      "direct-sql",
      "overlayering"
    ],
    "disposition": "Rebuild",
    "target_pattern": "Data entity, export, reporting replica, or data lake pattern",
    "effort_points": 11,
    "confidence": "High",
    "confidence_reason": "Inventory row contains strong classification evidence.",
    "rationale": "Legacy integrations usually need redesign for D365FO operations and monitoring."
  },
  {
    "source_file": "ax2009-finance-inventory.csv",
    "category": "report",
    "object_type": "Report",
    "name": "TaxAuditPack",
    "layer": "CUS",
    "module": "Tax",
    "usage": "Quarterly",
    "complexity": "High",
    "technology": "SSRS",
    "business_purpose": "Tax audit reporting",
    "risk_flags": [
      "overlayering",
      "report-rationalization"
    ],
    "disposition": "Standard / Power BI Review",
    "target_pattern": "D365FO workspace, SSRS, Power BI, Financial Reporter, or archive",
    "effort_points": 9,
    "confidence": "High",
    "confidence_reason": "Inventory row contains strong classification evidence.",
    "rationale": "Reports should be rationalized before rebuild."
  },
  {
    "source_file": "ax2009-finance-inventory.csv",
    "category": "security",
    "object_type": "Role",
    "name": "LegacyFinanceController",
    "layer": "USR",
    "module": "Finance",
    "usage": "High",
    "complexity": "Medium",
    "technology": "AX role",
    "business_purpose": "Finance controller permissions",
    "risk_flags": [
      "overlayering"
    ],
    "disposition": "Map",
    "target_pattern": "D365FO roles, duties, privileges, and SoD review",
    "effort_points": 5,
    "confidence": "High",
    "confidence_reason": "Inventory row contains strong classification evidence.",
    "rationale": "Security must be mapped rather than technically migrated as-is."
  }
]