[
  {
    "source_file": "sample-ax-inventory.csv",
    "category": "object",
    "object_type": "Class",
    "name": "SalesFormLetter_Extension",
    "layer": "CUS",
    "module": "Sales",
    "usage": "High",
    "complexity": "High",
    "technology": "X++",
    "business_purpose": "Custom posting validation for sales invoices",
    "risk_flags": [
      "overlayering",
      "posting"
    ],
    "disposition": "Extend",
    "target_pattern": "Chain of Command or event handler",
    "effort_points": 9,
    "confidence": "High",
    "confidence_reason": "Inventory row contains strong classification evidence.",
    "rationale": "Customization likely needs extension-based migration."
  },
  {
    "source_file": "sample-ax-inventory.csv",
    "category": "object",
    "object_type": "Form",
    "name": "CustTableLegacyCreditCheck",
    "layer": "USR",
    "module": "Accounts receivable",
    "usage": "Low",
    "complexity": "Medium",
    "technology": "X++",
    "business_purpose": "Old customer credit check form customization",
    "risk_flags": [
      "overlayering"
    ],
    "disposition": "Retire Candidate",
    "target_pattern": "Business validation before migration",
    "effort_points": 7,
    "confidence": "High",
    "confidence_reason": "Inventory row contains strong classification evidence.",
    "rationale": "Low usage suggests scope reduction opportunity."
  },
  {
    "source_file": "sample-ax-inventory.csv",
    "category": "integration",
    "object_type": "Service",
    "name": "AIFCustomerExport",
    "layer": "CUS",
    "module": "Accounts receivable",
    "usage": "Daily",
    "complexity": "High",
    "technology": "AIF",
    "business_purpose": "Exports customer updates to CRM",
    "risk_flags": [
      "aif",
      "overlayering"
    ],
    "disposition": "Rebuild",
    "target_pattern": "OData, custom service, Business Events, or middleware",
    "effort_points": 11,
    "confidence": "High",
    "confidence_reason": "Inventory row contains strong classification evidence.",
    "rationale": "Legacy integrations usually need redesign for D365FO operations and monitoring."
  },
  {
    "source_file": "sample-ax-inventory.csv",
    "category": "integration",
    "object_type": "Interface",
    "name": "WarehouseFileDrop",
    "layer": "CUS",
    "module": "Warehouse management",
    "usage": "Hourly",
    "complexity": "Medium",
    "technology": "CSV file drop",
    "business_purpose": "Outbound warehouse orders",
    "risk_flags": [
      "overlayering"
    ],
    "disposition": "Rebuild",
    "target_pattern": "Managed file integration through middleware or recurring data jobs",
    "effort_points": 8,
    "confidence": "High",
    "confidence_reason": "Inventory row contains strong classification evidence.",
    "rationale": "Legacy integrations usually need redesign for D365FO operations and monitoring."
  },
  {
    "source_file": "sample-ax-inventory.csv",
    "category": "report",
    "object_type": "Report",
    "name": "InventAgingCustom",
    "layer": "CUS",
    "module": "Inventory",
    "usage": "Monthly",
    "complexity": "Medium",
    "technology": "SSRS",
    "business_purpose": "Custom inventory aging report",
    "risk_flags": [
      "overlayering",
      "report-rationalization"
    ],
    "disposition": "Standard / Power BI Review",
    "target_pattern": "D365FO workspace, SSRS, Power BI, Financial Reporter, or archive",
    "effort_points": 7,
    "confidence": "High",
    "confidence_reason": "Inventory row contains strong classification evidence.",
    "rationale": "Reports should be rationalized before rebuild."
  },
  {
    "source_file": "sample-ax-inventory.csv",
    "category": "isv",
    "object_type": "Addon",
    "name": "LegacyTaxAddon",
    "layer": "VAR",
    "module": "Tax",
    "usage": "High",
    "complexity": "High",
    "technology": "ISV",
    "business_purpose": "Localized tax calculation",
    "risk_flags": [
      "overlayering"
    ],
    "disposition": "ISV Review",
    "target_pattern": "D365FO ISV successor, standard replacement, custom extension, or retire",
    "effort_points": 11,
    "confidence": "High",
    "confidence_reason": "Inventory row contains strong classification evidence.",
    "rationale": "ISV capability needs product roadmap and licensing validation."
  },
  {
    "source_file": "sample-ax-inventory.csv",
    "category": "security",
    "object_type": "Role",
    "name": "LegacyWarehouseSupervisor",
    "layer": "USR",
    "module": "Warehouse management",
    "usage": "High",
    "complexity": "Low",
    "technology": "AX role",
    "business_purpose": "Warehouse supervisor permissions",
    "risk_flags": [
      "overlayering"
    ],
    "disposition": "Map",
    "target_pattern": "D365FO roles, duties, privileges, and SoD review",
    "effort_points": 3,
    "confidence": "High",
    "confidence_reason": "Inventory row contains strong classification evidence.",
    "rationale": "Security must be mapped rather than technically migrated as-is."
  },
  {
    "source_file": "sample-ax-inventory.csv",
    "category": "data",
    "object_type": "Table",
    "name": "InventTransHistory",
    "layer": "DAT",
    "module": "Inventory",
    "usage": "High",
    "complexity": "High",
    "technology": "SQL history",
    "business_purpose": "Historical inventory transactions",
    "risk_flags": [
      "direct-sql",
      "posting"
    ],
    "disposition": "Rebuild",
    "target_pattern": "Extension/service/data entity redesign",
    "effort_points": 10,
    "confidence": "High",
    "confidence_reason": "Inventory row contains strong classification evidence.",
    "rationale": "Unsupported legacy dependency detected."
  }
]